review,tag_arr
"This McDonald's needs a security guard because the weird homeless people corner you and the begging starts. The shock of them sneaking around the corner is too much that you immediately don't hear what they say, so you just say NO!! And it is not dirty smelly bums, these are CAPABLE people who can go get a damn job and pay their way. This McDonald's is just weird.I only come here because my boyfriend like to make a late night run after work. ξThe drive thru people don't speak English and your order is always wrong. I don't know why they don't take debit or credit card after a certain time. They always ask for cash. I find it odd, that's all I'm saying. Some of the people I don't trust. They look shady as hell.This McDonald's is so odd!","[0, '0.6706', 0, 0, 0, '1.0', 0, 0]"
Slow and dirty....AND why do you have to wait in the drive thru for 5+ minutes at 6:45 am? It's not like there is a rush and they can't keep up with the orders....,"[0, 0, '1.0', '1.0', 0, 0, 0, 0]"
"Don't ever go here in the evening between midnight and 3am. The staff are as dumb as rocks, slow, can't understand them when trying to place an order. Oh, and usually between this time it's ""Cash only"" because for some reason it takes 3 or more hours to batch out their credit card machine. Not to mention the wait time. One time it took over 10 minutes for my sweet tea and fruit & yogurt parfait. Terrible service all around, don't let it's ""fancy"" interior fool you.","['0.6802', 0, 0, '1.0', 0, 0, 0, 0]"
"Everytime I go to this McDonalds I swear I will never go back but I am an idiot and I do. ξEverytime I go they are out of ice cream, literally everytime!!! The lines are always long and then when you get to the window and find out the only thing you want they don't have is the worst!!","[0, '0.7125', 0, '1.0', 0, 0, 0, 0]"
"There is usually atleast one person asking for money outside which makes me not want to go here. ξWhich, incidentally, is good and bad!","[0, 0, 0, 0, 0, '0.7308', 0, 0]"
"I'm constantly disappointed in this mcdonalds and it's the closest one to me sadly . But today was just the last leg for me , I guess my order was too complicated no onion no pickle on a cheese burger w/ melted cheese ( because most times the cheese is not melted ) and my receipt had my order correct but my burger still came with onions and pickles . So I went inside and waited for a new one to be prepared . Only to watch the lady preparing my food give me sooo much attitude , and cover my burger in ketchup . I just left the burger there , customer service was piss poor today . And every other day . Everyone looked miserable .","['0.6579', '1.0', 0, 0, 0, 0, 0, 0]"
"I was hopping after they spent so much money on redecorating, that this McDonald's would improve on customer service and cleanliness. BOY, WAS I WRONG!!!The family bathroom does not have a changing table, it was totally out of toilet paper, and the hand dryer was broken. I informed 2 managers of this, but they did nothing to rectify the (at least) one issue they could. There are no paper towels, just the hand dryer so one could be up the proverbial ""S"" creek without anything to clean up with. NASTY!!!I also informed ξthe same managers that there were spills (one water, one bubbles) in the play area, but no one ever came to clean them and my daughter almost slipped through one of the spills. They did not even put a warning sign out. I also reiterated about the toilet paper, and took it upon myself to place napkins on the sink. The food was not hot; in fact, barely warm. The napkin used on the floor where the water spill was, was black when I cleaned the area myself, I don't work there, but should have earned a paycheck, instead of paying them for what we had.","['1.0', 0, '0.6695', 0, '1.0', 0, 0, 0]"
"Quite possibly the worst McDonalds on the planet. Absolutely vile and disgusting, food and service alike.","['1.0', 0, 0, 0, '1.0', 0, 0, 0]"
"I love Mcdonalds, grew up on it and still take my boys there regularly and I have to say this. ξThe location off of the circle in Summerlin really has some hard times keeping up. ξThe place always seems to be a bit dirty both in the lobby and behind the counter. ξI dread getting a ""quick"" bite with the boys when we are in a hurry as they are never fast in the drive thru!! ξBUT the food is always just as good at any other Mcdonalds, so they do have that going for them!! ξIt is literally though one of the slowest mickey D's I have ever been to. ξAnd this is not just one experience, I go very regularly because as I said I love it and this one is the closest to me, so for convenience, but sometimes I wonder if it would be faster to drive seven minutes out of my way to another mcdonalds....Their Employees are so nice though, just not the best on the speed side of things!Maybe they will get better!","[0, 0, '0.6981', 0, 0, 0, 0, 0]"
"I rarely go to McDonalds but one day I was thinking about the chocolate dipped ice cream comes I used to get as a kid and I decided to stop by and get one. Not only did they not have them but when I compared their menu to the corporate menu, I realized they don't have many of the items that are supposed to be part of the standard menu.","[0, 0, 0, 0, 0, 0, '0.6909', 0]"
"The worse drive thru ever. Make sure to check your order if you make a mistake coming to this place. The lady in the drive thru has no costumer service what so ever. The attitude is way up there, and this place can really ruin your day specially if you are with your kids. This is use to be a fun place to bring your kids. Maybe McDonald got too BIG and they don't care about costumer service anymore? The management is a joke for hiring this kind of people. Specially whoever work today July 20,2012. 11am","['0.6909', '0.6909', 0, 0, 0, 0, 0, 0]"
"I never thought I would write a review of a McDonalds, much less have to write a negative review for a McDonald's. I don't even know how it's possible that a McDonald's could be so bad but unfortunately this one is. ξ Like many people, I have eaten at McDonalds all over America and even in several other countries. ξI have to say this is probably one of the worst McDonald's I've ever been to other than the one in Manila in the Philippines -and that's only because I'm not sure that what was in those burgers was even beef.Where do I begin? The service is terrible. I have never, not ONE time, gotten what I ordered. I get sweet tea when I ask for unsweetened. I get cheese when I ask for none. I get onions when I ask for none. I get 2 chicken sandwiches when I ask for 4 apple pies. ξI have given up on going through the drive thru because I always end up having to pull around, park, go in and wait in the long line of teenagers getting shakes ξjust to get them to correct my order. And even then, they don't get it right and I actually have to tell them, ""No see, this is a Chicken Sandwich, I ordered a McDouble.""The food is almost always cold. The burgers are dry and taste like they have been sitting on a shelf for more than an hour. And the fry's..ugh! When there are 6 cars in the drive thru and 20 people in line, I just don't understand how the fry's can be cold and stale. It absolutely defies logic. Yes, there are times that the food comes out hot. It's one of the reasons I keep going back. There's nothing like hot Fry's from McDonalds.. and also, just because it's McDonald's. Like it or not, it's a staple for working parents too tired to cook dinner after work some nights. It is unfortunate that they have no competition in the immediate area to keep them on their toes, otherwise they might actually try to improve their service and their product. I am sure they are turning a profit. No doubt. It seems to always be busy. However, I truly believe that if ANY other burger joint opened up right next door, this place would close down in a month. Every time I say I'm never going back, I still do. Unfortunately, tonight will be one of those nights as the kids specifically requested it. The shear dread of what I'm about to go through is what prompted this review. ξI really hope they improve. It hurts to have to knock a McDonald's.","['1', 0, 0, 0, 0, 0, 0, 0]"
The service time is as poor as the McDonalds at Euclid beach. The remodel is impressive. Work on service times,"[0, 0, 0, '1', 0, 0, 0, 0]"
"They open at 5am so I was the first in line today. I gave my order loud and clear, the cashier responded but the speaker was so quiet I could not understand. I went to the 1st window which had a sign saying hearing impaired could get assistance at that window, but no one was present. A few employees walked by, barely looking at me. Finally one waved for me to go to the 2nd window (notice there was no sign on the 1st window?). When I got to the 2nd window, the woman who took my order said she hadn't gotten it. At that point I was ready to leave, but I repeated it and waited several more minutes to get my order. At 509am I had my 2 bacon egg and cheese muffins with a hash brown. I gave them the 2 stars because the bagged the order correctly.","[0, '0.7179', 0, '1.0', 0, 0, 0, 0]"
"I am very amazed at the hard working employees of this McDonald's. They are so busy at this downtown location yet they manage to serve you your meal with a smile. They have so many different kinds of people, tourists, students, ξworkers and of course plenty of street bums/crazies. Yet they seem to function seamlessly. I come here because I am hooked on their McCafees and recently Frappuccinos and occasional small fries. It just amazes me that such a busy location can function so nicely. My order is always taken promptly. I do not stand in line more that 5 minutes and I am treated with a smile and because of this I took time out of my day to write this review for them as a thank you!","[0, 0, 0, 0, 0, '0.6529', 0, 0]"
I have tried this place twice. I hated it both the times. The fried were dry and the chicken sandwich had a really greasy patty and a single dried up lettuce. I couldn't eat it. The second time I tried the food here I got a stomach ache. I am done with this place. Need more food choices inside the terminal not just outside.,"[0, 0, 0, 0, '1', 0, 0, 0]"
"For being a McDonalds Express, there is no ""Express"" about it! ξThe last time I was here in July, I swore it would be my last and it has been. ξI would rather drive to Pilsen or South Loop to another McDonalds, than to set foot in here again. ξThe parking is ridiculous...be careful and grab your kids hands while crossing the lot!I was in a hurry that summer Sunday in July, so I stopped in to pick up some breakfast sandwiches to go. ξNot only did I wait over a half hour in line, but the ξorder takers did not seem at all concerned that ξthere was a line out the door. ξIt was so crowded in there, people were breathing down my neck, actually in my personal space. ξ Homeless looking people were allowed to walk in and hang out and the cashier had a huge hickey on her neck. ξWTF!","[0, 0, 0, '0.6725', 0, '0.6784', 0, 0]"
Poor service. Waited 25 minutes in the drive through with some poor person blasting rap right behind me. Would choose any other fast food place over this location in particular. Do not eat here.,"[0, 0, 0, '1', 0, 0, 0, 0]"
"So I was at a Mc.Donald's and I looked down at my Mc Flurry and I noriced that it didn't have enough oreo toppings in it. So I asked the lady if she could add a bit more. She hands it back to me and I see that she just added ice-cream, and my cousin's mcflurry had a lot f cookies and mine didn't have almost nothing. I went back and explained to her what had happened. Then I turn around and she's back with the manager. Im like ""Why is he here?"" We hust left. She sucks as a manager.","['1', 0, 0, 0, 0, 0, 0, 0]"
Service is terribly slow. Orders have never been correct. Manager Oscar is trained in a third world country. I have boycotted this location for the last year and I live and work within walking distance of this place. I'd much rather go out of my way and give my money to the Boca Park location.,"[0, '0.6941', 0, '0.6629', 0, 0, 0, 0]"
"Fries were old and cold...they were out of ice. Asked for the sandwich to be plain, it did not come that way. They forgot to give us our drinks.","[0, 0, 0, 0, '0.6939', 0, 0, 0]"
"This has to be the WORST McDonalds within a 3,000 mile radius. The staff are young, rude, untrained kids from the local middle school and the drive-through is really painfull. This location should be closed down or sold to someone who knows how to run a McDonalds. They're always out of something, there's never a cashier in the first drive- through window (where your supposed to pay) so people sit in their cars and wait for a cashier to magically appear to take their money..not happening! So then you decide to walk in to order thinking you'll get your order faster and not missing something..WRONG! As you stand there and wait for them to make and bag your order your watching the car that would have been behind you, in the drive-through, leave. WTF! Next time, I'm getting Mexican food!","['0.672', 0, 0, '1.0', 0, 0, 0, 0]"
Go the the rainbow location instead. This location constantly forgets napkins and the staff is rarely friendly. Worth it to just drive a couple miles to the other location.,"['1', 0, 0, 0, 0, 0, 0, 0]"
"We go here sometimes at lunch or right after work for a snack (since we work nearby), but in general it's pretty dirty. ξFood tastes consistent with McDonald's quality and the employees are very nice. ξJust needs to be on McDonald's list of remodels.","[0, 0, '1', 0, 0, 0, 0, 0]"
"This is my second time here and again I had to leave after getting a refund for waiting so long for no food. ξI was not the only one. ξI am sure the staff work hard. ξMost seem to have become jaded. ξNothing is their fault and no one, not even management seems to take ownership to solve problems, move customers in and out quickly and keep the store under control. First, it seems half the customers want ice cream or smoothies and they end up taking a lot of orders and quickly get back logged. ξThere is no good system in place on who ordered, where they go, etc. ξIt always seems to be pandemonium in here.I placed my order and waited. ξAnother man was upset that he wait 20 min and still had not gotten his fries. ξI had to wait and wait for a soda - so long that my fries were now cold (they have a self serve soda in the lobby but because of all the homeless and crazy kids no longer use it so it takes longer to get sodas (with their one working behind the counter machine)). ξIt always seems drive thru customers have priority.I knew it was a mistake walking in and probably will not return again.","[0, 0, 0, '1', 0, 0, 0, 0]"
"Drive-Through sucks for Customers AND Employees! I was here last winter and they built what looks like a parking lot payment booth on the edge of the building so you can pay before you get up to the next window. You have to swing sharply around this booth because the lot was most certainly designed before the booth was added. Last winter I saw a super elder employee wearing a jacket in this booth. I am certain they can not keep this booth up to required heat levels in chicago! I felt so bad for this old lady wearing a thick coat and scarf! The summer before I brought my neice to play in the playhouse and it was hotter than heck in there when I asked for airconditioning they said ""its broken"" about a week and a half later it was still hot and still broken or so I was told. You think that if a company like McDonalds called a heating and aircondition company they would be there like super fast! I think it was cost cutting saving electricity!","[0, 0, '0.6667', 0, 0, 0, 0, 0]"
"Very bad... Drive through wait time 10 mins!!! And I'm the first one in line, not acceptable.","[0, 0, 0, '1', 0, 0, 0, 0]"
"I went through the drive through to order oatmeal and received what appeared to be a version of the product that was microwaved for 10 seconds.. ξWhen I went inside and asked for the manager, Maria came over to ""correct"" the error of the runny oatmeal. ξWhen she came back with my revamped order, the oatmeal was flooded with even more liquid. ξThis time I received the disclaimer that the oatmeal would need a few minutes to sit before eating due to the instant not homemade process. ξ10 minutes later and my stomach is still empty. I know it is McDonald's, but I still expect a product that a least looks appealing to eat.","[0, 0, 0, 0, '1', 0, 0, 0]"
"I don't go to McDonald's looking for anything great. I mean, it's McDonald's... howevee I am very picky about condiments so I always order my burgers plain. This McDonald's is so ridiculous. They mess up my order every time. One time they gave me coffee with creamer and sugar when I ordered black, they actually put more effort into messing up my order than making it correctly. Another time they put my fries in my bag upside down. They forgot two burgers and a large fry one time when I was picking up supper on my way home. They almost always fail to make my burger plain even though the receipt clearly says plain. They remake your food if they messed up but they aren't nice about it and they never offer you anything like a coupon or something free to make up for their mistake. And they're coffee in the morning is always burnt. It's terrible! The only thing they do right is the frappes and I've only ever ordered one!","['0.6799', '1.0', 0, 0, '0.6799', 0, 0, 0]"
"Super slow service, food's terrible like its been sitting and then reheated. ξEverything is out, napkins, iced tea","[0, 0, 0, '1.0', '1.0', 0, '1.0', 0]"
"They recently gave this location a renovation and updated it. It looks really nice and now has an indoor play area for the kiddos. It's super clean inside (at least when I went) though we actually had to ask someone where the trashcan was since it was hidden around a corner. Ketchup dispenser was broken and they gave me sweet and sour sauce instead of sweet chili like I asked. Now, I usually don't review fast food since it's pretty much the same no matter where you go, but this is the location closest to my house, and I can honestly say I rarely ever go because of one thing...they are SLOOWWWWWW! In the drive through, expect to wait around 10+ minutes. I even had two people behind me decide to leave after they had ordered, and I wasn't the one holding up the line! I ordered a Spicy McChicken and nuggets. I even considered if going inside would have been faster. Bottom line: this isn't the place to go if you want ""fast.""","[0, 0, 0, '1', 0, 0, 0, 0]"
This place is dirty bunch of high school kids works here which they don't ξcare about service,"['0.6875', 0, '1.0', 0, 0, 0, 0, 0]"
"The service was pretty bad. We ordered our food normally and we wondered why we were waiting so long, so when we checked on it they took our receipt and the time was apparently dated wrong and they accused of us lying when we weren't. They said they'd get us our food and when we went back again, they asked us again if we wanted the money or food, so we ended up just leaving. I won't be coming back to this McDonald's again.","['1', 0, 0, 0, 0, 0, 0, 0]"
I had want here with my friend(1time) and my mom (2 time) it just like a regular McDonald`s they cook the food and you just keep it moving i just hate there is not a lot of seats to sit other then that i don`t have a issue with it my honest opinion :),"[0, 0, 0, 0, 0, '0.7316', 0, 0]"
"I stopped at this McDonald's because I had about two minutes to grab lunch. The ONLY reason I ever eat at a Mickey D's is because it's a) fast, b) cheap and c) predictable. You know the food won't be awesome, but it will be reasonably eatable. Man, was I disappointed on points b) and c).First, the medium Quarter Pounder meal was more than six bucks. Jeez, that's hardly a deal.What made the sticker shock worse was the poor quality of the food. This had to be the worst Quarter Pounder I've ever (half) eaten. Maybe even the worst fast food burger I've ever had. It looked like it had been sitting out on Uncle Zeke's radiator all morning. The burger patties were gray and curled up at the edges. The bun was dry and crusty. It's like the damn thing was somehow mummified. Just nasty. Too bad I didn't have time to take it back.This will probably be the very last time I ever eat at a McDonald's. It was that bad.","[0, 0, 0, 0, '1.0', 0, 0, '0.6725']"
Slowest McDonalds ever....especially in the mornings,"[0, 0, 0, '1', 0, 0, 0, 0]"
"Sad to say, I have seen worse. ξIt's convenient and relatively fast. Just not clean as it could be.The staff here are almost as depressed as the homeless people you find hanging around it","['0.6891', 0, '1.0', 0, 0, 0, 0, 0]"
"This McDonald's is a dirty, busy and chaotic experience. Typically there's one register open and when your number is called for your order you're missing a drink or too. I've had the chicken club sandwich ordered crispy and received it as grilled. Breakfast consisted of old oil fried hash browns and a decent iced mocha but it took me 10 minutes to get my order. The bathrooms are also dirty and missing the feminine waste receptacles in the stalls half the time. When an employee decides to clean there's mop water sloshed all over the place.","[0, '1.0', '1.0', 0, 0, 0, 0, 0]"
"The stingiest mcdonalds I've ever been to... Including downtown!!!Service: 4 -They were nice and spoke English. Great! ξ-Saw someone get a chocolate covered sundae... Only the darn thing wasn't even *covered*, as if they took an airbrush system and lightly sprayed a translucent film over. Tsk tsk Price: 3-they charge you for plastic bags, ketchup packers and god knows what else. I wouldn't be surprised if they charged me for napkins to-go.- gasped when I was told would be an extra 25 cents to get ketchup packets (a whole ketchup bottle wouldn't even cost you anymore than $2). Atmosphere: 4.5- went late afternoon, pretty empty; not loud, not dirty.Food: 2/5- didn't think I'd have to rate my food, until I came home and found that my fries were cold and stale as well as my nuggets. UGH. - irony is their employees understood english, but for the very first time in my life, they messed up my order. I said 1 ranch 1 barbecue... Instead 2 ranch sauce inside.","[0, 0, 0, 0, 0, 0, 0, '0.6749']"
"The worst McDonalds franchise I've visited. ξI fired off complaints to McDonalds Corp. ξthinking they might want something for their file to rid themselves of this lazy franchisee & all I got was a lame apology months later w/ a coupon for more food! ξIt was well after the dinner rush, every table was dirty, floors so sticky I almost walked outta my shoes, surly staff, just plain dirty.","['0.6717', '0.6717', '1.0', '0.6717', '0.6717', '0.6717', '0.6717', '0.6717']"
"Walked by tonight on my Neighborhood Watch Walk and there was a lady standing by the drive through speaker asking for $$.Feb. 16, 2011 ξ7:10pm","[0, 0, 0, 0, 0, '0.7179', 0, 0]"
"It was raining when I went to this McDonald's drive thru. A noteworthy point: do not go thru the drive thru in rainy weather. It is not covered at the order speaker and there is inadequate coverage at the order windows as well. I ordered a ten piece nugget combo large with fries. The nuggets had gristle in them and several seemed undercooked. The large Dr. Pepper was tasteless: they had let the syrup run out. I did not notice the drink until we left. Overall, I was disappointed. The fries were good though. The drive thru order taker was courteous though so I have to give them points for that.","[0, 0, 0, 0, '1', 0, 0, 0]"
"This place hands-down wins an award for efficiency... or lack thereof. Came here on a night where it was not busy. There were about 3 or 4 C-grade hooligans patrons who also had a craving for some dollar menu items. I ordered the dollar pop and it took the 30 or so employees behind the counter 10 minutes to take my order of a ""large coke"" then get me a cup of... A&W Root Beer. ξThe thing that perplexes me the most is that they have a self service fountain machine...","[0, 0, 0, '0.7223', 0, 0, 0, 0]"
"This is a large, relatively modern-looking mcds. Its a bit grimy, which in mho, kind of defeats the purpose of the remodel. Why bother making it all pretty & modern if youre not going to wipe it down regularly?The service here is ok. Food is standard mcds fare. The one reason we come here is for the HUGE four-story play area. The kids enjoy exploring it, and i enjoy getting a half hour of sanity. ξtheres a small space underneath for littler guys to play in, but this playplace is realistically more for older kids who can climb well. The kids room is completely closed off from the rest of the restaurant, which works great at keeping my boys from running off, and theres a separate bathroom in here just for aparents. ξNo changing table, which for some strange reason seems to be the way las vegas restaurants roll. I really hate that. Therefore they shouldnt be surprised when i change a poopy diaper on one of their posh bench seats since theres nowhere else to do it.Maybe then they'll wipe it down afterwards... But dont count on it.","[0, 0, '0.6667', 0, 0, 0, 0, 0]"
"Could have had a 5 course meal at a real restaurant in the time it took 5 cars to go through line. ξAlso, no mcflurry's or ice cream when we went.","[0, 0, 0, '0.6471', 0, 0, '1.0', 0]"
"Every time I go their ice cream machine is down. It's a hang out for all the kids in the neighborhood. This establishment including terribles chevron connected to it, does not seem to care what goes on in or around their business. Low class for the area they are in.","[0, '0.6607', 0, 0, 0, '1.0', '0.6607', 0]"
"Forgot half my order, then made me wait 10 mins to correct it. Not very fast food.","[0, '1.0', 0, '1.0', 0, 0, 0, 0]"
