review,tag_arr
"Food:It's a McDonald's. They are all the same food wise, right? I mean they have to be. Mac Snack Wrap those clever bastards. Not even good, but fun to say out loud when ordering. ξLocation:This one probably used to be all bright eyed and bushy tailed. With a roller backpack full of ideas anxiously waiting to get off the train at Union Station after the long trip from headquarters in Oak Brook, IL. Pockets filled with employee schedules and a neatly folded franchise license. Then it got lost. Lost into the heart of a dismaying darkness along a transient corridor known as Alameda. Its employee of the month dreams fading against the howling winds of reality in LA, but with its golden arches still standing as a beacon for those hungry.Staff:I didn't think McDonald's could possibly produce employees this professionally hardened. No. The staff here have to be contractors. Hired guns. Soldiers of Fortune. Blackwater mercenaries. ξWarriors jaded after years of serving tours in suburbia and south central. They are a high speed low drag group geared up everyday to get our food hot and fast while defending their outpost from the raiding bands of scavengers. ξSend this icy eyed crew into Afghanistan and watch the New York Times' and Amnesty International's front covers fill with pictures of crying children and burning villages. ξ...............................................This is the closest MCD's to my place downtown so eff it. Yes, the locals can be annoying as the other reviewers have stated. I am cautious to say that they are harmless because I cannot guarantee that. ξEating inside was probably one the most colorful experiences and worst mistakes I ever made in my life and I'll leave it at that. ξThe drive thru is not so bad. ξAt the window the employees will yell at the locals to leave you alone. Which often times they will. Just, ""Never get out of the boat"" when you crave those delicious corn product filled meat ξpatties.","[0, 0, 0, 0, 0, '0.6899', 0, 0]"
"It's fast food, right? ξWell... it's food, at least.There are three McDonald's within two blocks of my work (maybe more for all I know) and this one has THE WORST SERVICE of any of them. ξI understand the people working the counter are getting minimum wage or slightly higher and are not super excited about their jobs or innovating the industry.But seriously, will someone take my damn order already!??I can't count the number of times I have been here where I stand in line at a register and when I finally get to the front the person is running around without any clear direction running food to other registers for the people who arrived after me but were lucky enough to win the register lottery. ξMultiple times I have had to get someone's attention and remind them that I am still waiting to place my order.It's not rocket science. ξHeck, it's not even science. ξIt's service. ξPlain and simple. ξDivide and conquer: one group of people take orders and another group of people run the food while yet another makes it in the back. ξSounds simple, right? ξWell it doesn't appear so simple when you walk into this McDonald's.I have worked in the food service industry as a waiter and I understand that people have different ideas on what is good service but one thing is always constant: greet your customer and communicate with them. ξLet them know if you'll be a minute; inform them if there's a wait. ξWhatever the issue just let them know; they'll appreciate you more for it and be more willing and patient to wait.Other than the service this is, well, McDonald's. ξDoesn't matter which one you go to you get pretty much the same thing. ξThat's the hallmark of their business. ξThe only difference is service.So, pay attention franchisees: McDonald's may continue to get my money but you independent franchise owners may soon lose valuable customers with poor service.Afterall, there's a McDonald's within a couple miles just about anywhere in developed countries.","['0.656', 0, 0, '0.688', 0, 0, 0, 0]"
"This is the slowest mcdonalds I have ever been too. It tools between 5-10 minutes to get your food inside, and at least 5 minutes for drive through. Ever since they have opened, they have always been slow.","[0, 0, 0, '0.6981', 0, 0, 0, 0]"
This has to be the worst McDonalds on the planet. The drive thru has got to be the slowest drive thru in the world. I have never had an order there where I didn't have to pull forward and wait. And the number of times I've driven all the way home only to find out they put the wrong order in the bag this has been going on for years.,"[0, '0.6891', 0, '1.0', 0, 0, 0, 0]"
"Work nearby so used to stop for drive thru breakfast items. Poorest McDonalds I have ever been to and with five miles of World headquarters in Oak Brook. I would say they got my order correct about 45 percent of the time. The manager after a time recognized me when I parked and came in for order correction. It is not only me, I work in a 80 persons office and when I see someone carrying a Mc Donald's before I can ask , they begin to tell me how their coffee or sandwich was wrong. My biggest grip is paying for extra condiments (syrup) and not getting it . It is on my receipt ..... Staff cannot read or when you ask them , they lie to you they put in. I know bigger problems to worry about in world. But when you pay extra for something and then get lied to ....... Hello Burger King......","[0, '1', 0, 0, 0, 0, 0, 0]"
"Bar none.. Worst McDonalds. If you frequent this location you are assured to be greeted by a rude, disinterested and barely literate individual who will deliver you an incomplete or incorrect order. I live in the area and have kept a tally on my visits.... 15 visits in 1 year, 4 of the orders were filled with out any problems. All of which were performed by the morning breakfast crew, which is FANTASTIC. A couple of the morning people have been there a long time and you can tell that they actually care about their jobs and want to be there. I am sure it cant be easy to staff a McDs.. but this location is terrible. ξIf only i didnt get my yearly cheese burger craving, i would never go to this location again.","['1.0', '0.6842', 0, 0, 0, 0, 0, 0]"
"The only reason I come here every now and then, is because it's close to our home. Otherwise, this place is known to mess up your drive-thru order.","[0, '1', 0, 0, 0, 0, 0, 0]"
I stopped coming to this location because they NEVER give you napkins in the drive-thru..employees here are pretty grumpy.,"['1.0', '0.6667', 0, 0, 0, 0, 0, 0]"
"Rita A's review is dead on. I stop here on occasion and they cannot get anything right. If I order a shake, the shake machine is ""down"". Ask for no ketchup on my sandwich? Make that extra ketchup, no mustard. Light ice? Load the cup to the top!Getting my order wrong 50% of the time aside, the service is also frequently unfriendly or distracted and almost always painfully slow.I'd rather skip it and go somewhere that can get my order right and do it with a smile.","['0.6668', '1.0', 0, '1.0', 0, 0, 0, 0]"
"We stopped by here on our way out of town to grab coffee, etc. Let me just say Ill NEVER come back. This place is completely sketchy. There's people randomly lingering around outside. Keep your windows rolled up and your doors locked while waiting. My coffee was warm but not hot as the outside label claimed. It also tasted burned. How exactly do you burn coffee? Overall, not a place Ill ever return and would not encourage anyone to visit.","[0, 0, 0, 0, '1.0', '1.0', 0, 0]"
"I normally try to hit up this location when I'm at the Sam's gas station across the parking. ξUnfortunately, I normally stop for gas in the morning and this location is a nightmare at that hour. ξThe drive-thru line is wrapped around the building and the line in the lobby is packed. ξI'm sure how you address these issues without completely remodeling the restaurant to re-orient the driveway and open up a double-driveway.I was here the other day for a Redbox movie and got a drink---the staff is normally pretty courteous but that drive-thru issue really brings down their rating in my mind.","[0, 0, 0, '0.7179', 0, 0, 0, 0]"
"One time I was waiting for my meal, about 10 minutes went by, I asked the cashier where is my foods? She answered someone took it, I waited another 5 minutes for them to make another one. This has happened to me twice at this MacDonald, ξI don't know who to blame, the customers who thought there is another bag of food sitting here and just grab it or the cashier who didn't care the right person get the foods. Anyway, this MacDonald is one of kind, I went to many other fast foods joints.","['0.6662', 0, 0, '1.0', 0, 0, 0, 0]"
"Whenever I travel alone, I tend to focus on trying places I'd never see at home. ξBut whenever I travel with others, which is often, there is almost always someone who can't stomach the idea of eating something that isn't familiar to them, so hence, I find myself at Mickey D's. ξThis one out of Terminal B is especially atrocious, even for the mediocre benchmarks of McDonalds nationwide. ξI eventually fled to the adjacent Panchito (yelp.com/biz/panchitos-m��_) which was equally terrible.The service at McDonalds is never particularly outstanding, but when it is, it's especially worth noting, I just wish this place had it. ξThe woman at the register was painfully slow, which on airport time can be excruciating. ξAfter paying the demons of airport overpricing, we continued to wait and wait ... to the point where I had to ask if our food was ever coming out.Oh. ξThe fryer's broken? ξThanks for telling me that awhile ago when I ordered the stuff in the first place. ξWait, there are some nuggets / fries that are already made? ξThat doesn't sound particularly appetizing either. ξBut who am I to complain? ξThis is fast food after all.In the interest of saving time we grab the sack of soggy french fries and crazy hard nuggets while I sip on a deflated coke. ξHow does one screw up a soft drink? ξIt still managed to happen here. ξAnd though I'm not one to shy away from complaining, it was already too late. ξAll of these discoveries were made while in our plane. ξCurses.","[0, 0, 0, '0.6909', '0.6909', 0, 0, 0]"
"One star rating for giving me practically half empty box of fries!!!! It has happened twiced!!! Usually my fries are packed all the way to the top and spilling but when I got it through drive through, it was very sad looking. When I held up the box, I couldn't even see the fries. BAD.","[0, '0.6206', 0, 0, 0, 0, 0, 0]"
I can't believe it!! A Mc Donald's without dipper changing station in the restrooms. Not a happy place for kids :( live them at home. Also no orange juice...,"[0, 0, 0, 0, 0, 0, '1', 0]"
"Came here around nine am for breakfast...there's allot of people in this particular Mc Donald's...probably cause it located in the city... Place opens 24 hours... The lines are all over the place... Your not even sure where you are suppose to be standing... But finally that ten min of waiting I finally got to order...got a plan ice cream sundae with peanuts ,two apples pies and sweet ice tea... The seating area is upstairs... There's a lot of seatings...so don't worry if there is no seats...there's two cleaning ladies upstairs...always tying to keep the place spotless... The bathroom is quite disgusting...there's two toilet in each restrooms...there's no door stall...so pretty much everybody can see your business... The area is extremely cramped... You can bearly ξmove... The sink doesn't work right...","[0, 0, '0.6808', 0, 0, 0, 0, 0]"
"Found a booth at the front, but an old man with a cane comes in and ends up stealing our seats because some McDonald's employees we're taking up the booth right next to it and wouldn't give up their seats for him. That looks real bad.The girl behind the counter was friendly, but my food took a little while longer than you'd expect. And when I asked for ketchup, she said it's in my bag, but when I got to my seat, it clearly wasn't. Then, when I went back to ask again for ketchup, she only gave me 2 packets. Not a big deal to me because that's how much I was going to use, but still, a bit stingy, eh?Food was fine, typical McDonald's. 2 stars because despite some Mickey D's employee blunders, the food was still ok.","['0.6564', '0.69', 0, 0, 0, 0, 0, 0]"
Unsanitary place! I walked in because I was filling up for gas instead of taking the drive thru. There are flies EVERYWHERE. Literally everywhere. I didn't stay long enough to order my food. Staff was standing around doing nothing - totally unprofessional.,"['0.691', 0, '0.691', 0, 0, 0, 0, 0]"
"It really doesn't get much worse than this.When walking in, I (unfortunately) saw a young female worker grab the butt of a young male worker as she was walking to her register. ξThe guy then said to her: ""If we ever closed this place together..."" to which she replied: ""We can't do that here!""I wish I was making this up...Both of them had to be 18 or less, and did not take their job seriously at all. ξWhen I finally got my order (apparently there was no one helping bag orders for the front, as I had to wait for the two love-birds to finish ALL of the orders from the line before they realized nothing was being made -- to which they frantically started trying to put together about 20 orders), I realized as I was driving away that the girl who bagged my order gave me the wrong burgers.Stay away. ξFar, far away. ξLike Star Wars ""galaxy far far away"" kind of far.Doesn't matter how hungry and in need of quick calories I'll be in the future, I'd rather not eat than come here again.","['0.6641', '1.0', 0, '0.6641', 0, 0, 0, 0]"
"Of course this is a fast food restaurant so of course there's not much of a spectacular review that I can write but I will express my concerns. I work late nights and when I do get off work if there nothing ready in the house I will stop and my only option is McDonalds or Checkers. Needless to say this is nothing short of ""ghetto"". I could hear the employees in the background laughing and playing over the intercom as I'm ordering the food. After I ordered, she didn't even bother to tell me my total or go over my order with me. ξWhen I made it to the window she was having a conversation with her co worker despite me having my hand out the window to give her the money. When I drove up to the second window....someone had been smoking a cigarette and threw it right outside the drive-through window. Now I don't know if it was maybe a previous customer or and employee but nobody was in front of me when I pulled up but hard to say. I could hear the music they were playing over my radio in the car and to top it off. Somebody was calling another chick a ""B*tch"" and just being loud. I mean hey, didn't expect nothing spectacular but if these are the people thats making my Big Mac, I'll pass. The day shift is the complete opposite so don't be discouraged too much by this. My food tasted McDonalds worthy but they need to change up that scenery a bit.","['0.6836', 0, 0, 0, 0, '0.67', 0, 0]"
Went there on a Sunday afternoon. ξIt was only moderately busy. But only one cashier (Jessica Carter) taking orders. She complained that kids in general in restaurant were screaming too loud and that she was too busy to accurately take our orders. Waited more than 20 minutes for our food. The order as placed on tray was incorrect. ξA new low in fast food...,"['0.641', '0.7179', 0, '1.0', 0, 0, 0, 0]"
Truly disgusting place.,"[0, 0, '1', 0, 0, 0, 0, 0]"
"This McDonalds is terrible. I don't expect much from fast food but there is a standard... a low one but at least reach minimal expectations. ξ My son and I went through the drive through (took forever). They have the nerve to ask ""is everything on the screen correct"". ξAfter we got our food, we pulled forward in the drive-thru to allow traffic to move. ξI explained to my son that we need to check and make sure we got everything.... ξ I ordered big Mac meal and happy meal -burger plain. ξ They missed the toy and my fries and his burger... how? ξWe went inside and had to convince them that we really didn't get everything. They got what we were missing and we went home. ξ My son was disappointed. ξI ordered burger plain for a reason. ξThey were too busy chatting behind the counter to pay attention to the order they already screwed up. No apology. Nothing. ξ I would let this slide if this was the only time. Hire people that work! ξI don't expect a five star meal but get the order right. If not the first time, at least don't screw it up twice!","['1.0', '1.0', 0, 0, 0, 0, 0, 0]"
"I don't go here often because the service is so bad! I have never left with the right order or sat in line less than 15 mins. They are now running this special where they give you a 1 min timer & if you don't get your order by the end of the min you get your meal free. But IT DOESNT COUNT IF THEY GIVE YOU WRONG ORDER! yep, they gave me 4 nuggets (in a 10 nugget box) & a coke when I ordered a burger & hi-c!! Smh They need 3 windows - one to pay , one to pick up & the last to return the wrong order & pick up the correct one!!","[0, '1.0', 0, '0.6672', 0, 0, 0, 0]"
"What is a Shamrock Shake? It's a seasonal shake (milk?) by McDonald's with green food coloring thrown in designed to exploit another made up holiday, St. Patty's day. You can tell it's fake as crap because the food coloring they throw in doesn't blend well. Parts of the shake will be a deep shade of green and then rivers of white will intertwine with lighter shades of green. This is your first warning : there is nothing natural about this drink, proceed at your own risk. In the name of Yelp, I purchased a shamrock shake to review. What does it taste like? At first... not bad actually. Like a melted down Andes Mint, cooled and thrown into a shake. It doesn't quite taste like a milkshake, it just tastes like a chocolate mint melted down.This is good for awhile... until you reach the halfway point and you're disgusted and want no part of the shake. Not sure if it was just overkill for me, or if its the shake in general. Worth a try, bu nothing to call home about.","[0, 0, 0, 0, '0.6667', 0, 0, 0]"
Staff is mentally challenged. Cashier had a line of 6 people waiting to order and instead chose to spend 10 minutes sorting through and organizing Happy Meal toys,"[0, 0, 0, '0.6458', 0, 0, 0, 0]"
"The coffee here gives me the worst runs ever. It's like they put laxative in it or something. I do like the french fries as if you are ever stopped up, they help you return to regular pretty quick. I am not please with the happy meal selection. My son wanted a car and instead he got a penguin.The restroom needs some attention.","[0, 0, '0.6831', 0, '1.0', 0, 0, 0]"
"I have never in my life wrote a corporation to complain about the business until this McDonalds. I am there everyday with the same coffee order and everyday they get it wrong. You would think after going there everyday for months you would think they would know the order by now but apparently they are stoned or something. Also, more than once I have attempted to order ice cream after nine at night and they tell me the 'ice cream machine is broken' because they are too lazy to fill it up. It is a credit to the McDonald's corporation that they actually responded to the complaint letter and said they would fix it-the next day still the wrong coffee order.","['0.6441', '0.6571', 0, 0, 0, 0, 0, 0]"
"Lord do I despise this place. If it wasn't for the fact that they are right next door to me, quick & cheap I would never come here. First of all this place is always packed and dirty. None of the employees speak any English, we are in America wtf?So I was standing in line behind someone and the cashier asks how can I help you? Umm excuse me there is someone still putting there change in their purse, how rude! I told her to wait, she insisted I place my order so I did. She took the next person while my good was placed on the tray. So both the cashier and customer are breathing over my food. How disgusting is this?There customer service is horrible. The manager apparently doesn't know what he is doing! I asked once to receive a refund for an order I did not place it was a mistake on their park and he gave me a dollar BACK! Really?!?! Horrible all around.","[0, 0, '1', 0, 0, 0, 0, 0]"
Terrible service! Staff was too busy chatting with each other . I left with my 2 children after waiting 5 min to place an order. I will never return to this McDonald's ! I will take my business elsewhere and recommend you do the same.,"['1', 0, 0, 0, 0, 0, 0, 0]"
"It was gross, I choked down the burger. I didn't like the fries either, the girl was cute though. The place was filled with old timers nursing cups of coffee and throwing hard looks around. I found myself wondering why this place is so popular. It was about $4 bucks I guess you don't get much for $4 dollars anymore.","[0, 0, 0, 0, '1.0', 0, 0, '0.6531']"
Food is good but what's with all the flies and nats always in the air? ξI've mentoned this to management before but it seems like nothing has changed. ξ I'm going to the McDonald's on Hudson Bridge from now on.,"[0, 0, '1', 0, 0, 0, 0, 0]"
"I am a big fan of Mc Donalds, however the young ladies at the registers are unprofessional, and untrained. The promotion for buy one Quater pounder get one free after doing a review is lost upon the entire staff. This was on a monday, but happened again on a tuesday. I am telling everyone i know, and i have a LARGE Twitter follower, also as a HUGE facebook following.","['1', 0, 0, 0, 0, 0, 0, 0]"
"this is CLEARLY a franchise location, and they.do.not.care. This place is a cash cow. The staff is totally random (have had some decent service, and times I would be better going to the overpriced gas station next door).Clearly the new/bigger menu has the staff utterly overwhelmed. (oh, when a place has ""NOW HIRING ALL SHIFTS"" signs up for ever...be warned.... there is one elderly latina lady at the drive thru whose 'here you go hun' and smile could melt and iceberg- what a joy! but...once had horrible service- complained and got an out of date coupon for one small sandwich, fries, and drink. really?","[0, '0.6341', 0, '1.0', 0, 0, 0, 0]"
"So horrible no matter what time of day it is, you'll always get food that has been prepared so messy.","[0, 0, 0, 0, '0.7112', 0, 0, 0]"
Went there just to get coffee in the morning and the one thing I need in the morning COFFEE was apparently out of order.,"[0, '1', 0, 0, 0, 0, 0, 0]"
"This is the worst location ever! I refuse to go to this location. In all the years that I went, I never had an order that was correct. ξThe staff was rude, and one time when I stopped, one employee had her child there just running wild behind the counter","[0, '0.6397', 0, 0, 0, 0, 0, 0]"
"This location is run by the worst management ever there is constant arguing in the grill area and even at the front counter.Massive customer complaints,orders are never received correctly or on time.If I could give this location a -5 i would","['0.7049', '0.6746', 0, 0, 0, 0, 0, 0]"
"Had ordered a big Mac and jalapeno double and it is the first time I had to call and let them know how the food is. The big mac's lettuce was soggy and old and the jalapeno double had little to no sauce and three jalapeno slices. The fries were refried over and over cause they were Brown and way over salted. I called and the manager was super nice apologized and offered me two meals at no cost and never mentioned I needed a receipt because I had already told her I threw it away. She said she would just write down my name and put it in the books. I take up the offer on a different day and they don't know what I'm talking about, I pay but get home and the buns are burnt and the order was wrong again. I asked for no meat on the mcmuffin for my daughter and what do they add on, meat. Yeah I can take it off myself but the point is is obviously they do not listen to there customers or just don't pay attention, I mean every encounter there they always forget, or simply make a mistake. Either way I'm taking my business else where. Management is not organized and you can't trust their words! The crew is super nice though! I didn't want to have to post this or the pictures but they aren't listening so maybe they need to see it, pretty sure I wouldn't need a receipt now.","[0, '0.6629', 0, 0, 0, 0, 0, 0]"
I hate this place. ξI will go without coffee and eating no matter how tired and/or starving I am. ξTons of people working and no one waits on the customers. ξOr the white customers take a back seat to the black customers even if the white customer is the next person in line. ξI complained to OakBrook Corporate Headquarters and still after that had bad experiences here. ξI don't think I will go to any McDonald's anymore.,"['1', 0, 0, 0, 0, 0, 0, 0]"
"Have to agree with others, this is a lousy McDonalds. Terribly slow, only one register open, guy yawning constantly even though only 1:30 pm. But the Food was hot.","[0, 0, 0, '1', 0, 0, 0, 0]"
"We have tried several times to give this location chances. No more chances, bad food, service is slow at drive up. Plus after midnight we have been told no use of credit or debit card's at pick up window not at drive up screen.Cold food ξmore than once, along with watered down drinks due being poured early with many cars in front of us after we have ordered. Manager could care less, ξhe ignored us when we asked for him. We drive out of Sherwood to get McDonald's until new management.","['0.6667', 0, 0, '1.0', '1.0', 0, 0, 0]"
Awful service (super slow). ξJust wanted a mcflurry and it took over ten minutes with only two people ahead of me in line. ξDoesn't seem clean.,"['0.6346', 0, 0, '1.0', 0, 0, 0, 0]"
