review,tag_arr
"I have yet to get an order correct at this ξlocation. ξYou get smart ass remarks when ξu speak to the manager, and corporate just apologizes and do not take any steps to improve this location. ξ Even if i just order a hamburger and ξfri, i will ξget cheeseburger and the ξfri is missing. ξEmployees are rude and act like they r hanging ξon the street rather than working ξat a job. ξThey need to hire competent employees who really want ajob and have enough self respect to perform their job with some pride. ξIts a shame ξbecause ξit is an ideal location and i hate having to drive to a further location because they just can't get it.","[0, '1', 0, 0, 0, 0, 0, 0]"
At a time when people are finally realizing that we must eat healthy to be healthy McDonalds makes no moves away from their overly processed junk food. This McDonalds is focused on cars and its parking lot is twice as big as the restaurant. Go to the La Perla Tapatia which is right next door.,"[0, 0, 0, 0, '1', 0, 0, 0]"
"I was not impressed with my visit this time to this location. Suprisingly it was by someone who is a shift manager who was working the window. How can you take my order over the speaker and still have a conversation with another employee? It took her several tries to get my order right!! Then when I get to the window she doesn't even say hi or tell me my total just puts her hand out for payment. As I gave her my card I asked her to please give me jelly and extra syrup and butter. All she did was smile when I said thank you. Took them a good 15 minutes to get my stuff as she was a way from window by the inside counters talking to employees. When she finally gave me my order I reasked that I got the jelly and syrup and she goes to reach to get some and then says OH its in the bag. Now I ordered Big Breakfast with Hotcakes and Bacon, two sausage and egg mcmuffins, hashbrown and a coke. When I got home I got everything BUT the HASH Browns!!!! I was to get two of them one with the Big Breakfast and the extra one I ordered. UGGG it was on my receipt. the name on the receipt stated KS #15. So not right especially by someone in Management","['1.0', '1.0', 0, '1.0', 0, 0, 0, 0]"
"I went here shortly after they opened. I got here at 12:45 to get a large coke with no ice. I went through the drive thru. The line was about 5 deep but I figured with it being fast food it would be fast. It took about 5 mins to get up to the speaker. I order a large coke no ice and the guy put it correctly on my screen. I paid in about 5 mins and got to the window to pick up in 5 more mins. So it was 1pm by this point. The lady at the 2nd window handed me a drink and said ""You just had a diet, right?"" I told her no, I had a large coke no ice. She leaves the window and comes back about 4 mins later. She hands me a bag of food and a diet coke. I told her no, I just want a large coke no ice. Oh, ok. So she goes back and comes back about 4 more mins later. She handed me a drink with no ice. I was so sick of this at this point that I pulled off. I knew it was going to be diet, I stabbed the straw in it and found diet. I was out of the parking lot by this point and raving mad. So I had to go turn around in another businesses parking lot. I got to the Mcdonalds parking lot entrance and the drive thru was so backed up I couldnt get back in. So I went the wrong way on the one way side of the building and parked all retardly. I ran inside dumped out the crappy diet and got my own coke. I was so furious, how hard is it to read a stupid screen. Lesson learned, never go through drive thru for a drink.....","[0, '1.0', 0, '1.0', 0, 0, 0, 0]"
"So, from the exterior, this McDonald's is fantabulous. I guess it was a remodel, because everything else in the area seemed new. I went through the drive through because it was raining (no, I was just really lazy), and the gentleman from the box was really unfriendly. I like my Dollar Menu with a smile. So, no thank you, I am not the Terminator, and I won't be back.","['1', 0, 0, 0, 0, 0, 0, 0]"
"I'LL HAVE ONE BREAKFAST MCMUFFIN, HOLD THE GUNFIREIf you're in Vegas for an event at the Convention Center, you'll probably be up early enough for breakfast. If you're not there on work, you might just want to sleep through this part of the day. McDonald's breakfast is not sold nearly long enough. I never make it there on time! How hard would it be to serve eggs all day?!! ξIn any case, this McD's is convenient to the convention center.We stopped here more than once on our last Vegas trip a couple months back. On one of the visits while dining in, we noticed a bullet hole in the window from the night before. Someone probably mad about breakfast not being served all day is my guess.Service was good. Food was average. The coolest thing about this location was the deco. It was so modern inside. Clean and cool. I like that.","[0, 0, 0, '0.6966', 0, 0, 0, 0]"
"worst drove thru ever. ξI was car #7 sitting in a dual drive thru for 8 minutes and not 1 car had moved. I park and go inside. the manager waits on me and I said that the drive thru has not moved. she says, "" yeah our drive thru system has gone done"". I said "" it would be nice if someone would walk out there and tell everyone and post a sign"". she walks away to fill my order, only to leave one of her long BLEACHED hairs in between my 2 frozen strawberry lemonades.","['0.6667', 0, 0, '1.0', 0, 0, 0, 0]"
"I come here every morning to get my coffee. ξOccasionally, I'll order a specialty McCafe drink, such as a pumpkin spiced latte. ξOnly one person that works there in the mornings can seem to get my orders correct. ξI've asked for large drinks, been charged for them, and then handed mediums. ξI have had un-mixed lattes, where the syrup is all on the bottom. ξToday, my latte seems to have extra syrup in it. ξI order non-fat milk in my coffee, and I'm pretty sure it's come back with cream in it. ξNo one can seem to get it right, and it is very frustrating. ξI'm just ordering coffee here.","[0, '1', 0, 0, 0, 0, 0, 0]"
horrible.... that is all. Do not go there.,"['0.6706', 0, 0, 0, 0, 0, 0, 0]"
"This is a very slow and disorganized restaurant. The wait times are often long and I regularly have to pull over because they don't have food ready. Be sure to carefully go through your order once you receive it, I've received wrong or incomplete orders many times. We also noticed very salty hamburger patties a couple times.Unless you're desperate for some McDonalds go elsewhere. On the other hand; if you're trying to kick your Micky Dee's habit the experience you'll routinely receive at this restaurant may help you do it.The only reason I'm not giving them a one star review is because I know I will probably eat there again - it's the only McDonalds option near my home.","[0, 0, 0, '1', 0, 0, 0, 0]"
"Defiantly not the best McDonalds that I have been to. ξThe food is pretty much the same as all others but the place itself is old, outdated and dirtier compared to other McDonalds that I have been to. ξThis location also still has a Play Place inside which I think is disgusting. This time I went there at 8pm and they told me they didn't have any Frappes left, I was kinda disappointed, I really wanted one.","[0, 0, '1.0', 0, 0, 0, '1.0', 0]"
one of the speakers was broken but it did not have a sign. so i had to back out to get to the other speaker. first of all they asked me what i ordered they had no idea. i was asked about three times to repeat my order. i paid for a smoothie and they told me they did not have that flavor available. i payed for something then when i get to the second window they tell me they dont have it. ξit took forever to get my order. and this mcdolands is always packed.,"[0, 0, 0, '0.6852', 0, 0, 0, 0]"
Worst McDonalds in Vegas! Bad service consistently and sloppy made food. 3 trys and still crap. WTF! I am sure the hobo's panhandling outside could do better. They seriously must go out of the way to fuck things up. I just want to know what other McDonalds this Franchisee owns so I can avoid those also.,"['1.0', 0, 0, 0, '0.7', 0, 0, 0]"
"Rude employees for sure. ξEven the manager guy was rude.They have two lines and three windows. ξAfter ordering from one of the two menus/speakers, there's a sharp turn, and that's where the first window is. ξI had stopped at that window (since there was a car in front of me anyway), and no one was there. ξSince no one was standing there, and the car in front of me had moved forward, I moved forward as well.I looked into the second window, and no one was there either, but it was blocked off/had a sign to go to the next window. ξI waited for the car in front of me to move, while still looking back at that first window because I was 90% sure the girl that took my order said to go to the next window. ξStill no sign of anyone.I pulled up to the last window and the girl filling cups didn't acknowledge us. ξFinally, she opened the window and told another girl to take our debit card. ξThat girl, probably the youngest out of everyone I could see in the back, was friendly and took our debit card without glaring at us like the rest of the employees. ξBut she took our card somewhere else.Then the manager man came back with our card and pretty much threw it at me without saying anything. ξThe other girl that hadn't acknowledged us, but opened the window originally handed us our food and our drinks.I'm pretty sure they were being rude to us because we hadn't paid at the other window, but I'm pretty sure it's not the CUSTOMER'S fault that the EMPLOYEE at the register WAS NOT AT THE REGISTER.Good thing about franchises, especially McDonald's is that you can go to a different one. ξIf the staff isn't quite as rude as this one, even if they're still rude, I'd much rather go anywhere else. ξSo sorry YOU made a mistake, but don't take it out on us. ξYou're just giving a whole brand a bad name, no big.","['1', 0, 0, 0, 0, 0, 0, 0]"
"How hard could it possibly be to make an Egg McMuffin and not forget to include the EGG?! No joke, I got a sausage egg & cheese McMuffin with no egg in it this morning. Not only that, but my English muffin was burned!!! Ridiculous.","[0, '0.6829', 0, 0, '1.0', 0, 0, 0]"
"The reason I gave this McDonald's 2 stars instead of 1 is because of the young lady that was behind the counter.She had great customer service skills and although there were a lot of people in line she seemed to have a system and got the line down pretty quickly!I was also charged 2.99 for a sausage egg McMuffin that was listed at 2.79 and I was given my difference back even though they said the sandwich was suppose to be 2.99.I would have went back to that McDonald's if I wasn't at a volunteering event for seniors that day so I had no choice but to choke down my hard crisp eggs, burnt muffin and dried out sausage.I don't understand where Quality Control is going for many of these fast food restaurants, its like because we have a value menu or a dollar menu we don't have to serve food that is fresh and hot!Even if I was in the area unless I was just getting a coffee I wouldn't go back to this McDonald's!Just so sad!","[0, 0, 0, 0, '1', 0, 0, 0]"
"Do not ever use the drive through at this Mc Donald's it's ridiculous! You start off in one lane which then splits into 2 lanes so 2 cars can order at the same time, sounds good right? ξWrong! while you are waiting in the single lane there is no menus posted so once everyone gets to the 2 lane menu ordering board they look over the menu which takes some people an eternity. Then the double lane once again turns into a single lane. Can you imagine the confusion with people who don't understand the concept of lanes merging and want to be first to the ONE pay window and ONE food pick up window. I was in the drive through for 25 minutes there is no way out. I saw one near fight between 2 cars and 2 different women screaming at each other and the employees at the window. I gave it 2 stars because I feel bad for the people who work the drive through window and they were actually pretty nice. I will never go here again though. 25 minutes!!!!","[0, 0, 0, '0.6757', 0, '0.6654', 0, 0]"
"I've been here several times, only sporadically, because every time it is a nightmare and then I decide to give them another try. ξNEVER Again, ξService is terrible anytime day or night, especially the drive thru - 1 car or 6 it is the slowest thing I have ever experienced. ξThey can't seem to count the change or aren't able to keep up with which order they are on and it always ends the same with cold food or the order is wrong. ξAfter a terrible experience one night recently at 8:30 at night with 2 pp ahead of me I waited more than 15minutes!!! Got up to the window and they had to ask for my receipt to know what my order was and it was colder than cold when I left. ξI thought I was done then, but on my way to work, was in a hurry and drove thru for a simple sausage and muffin - nothing else - they confirmed my order, once again waited far too long esp. in the am. Got to the pay window, took my money and then closed the window on me, waited for her to open it again so I could ask for a receipt. ξWhen I asked she said very rudely - In a minute - then continued talking to another employee. ξFinally, got my order and it was wrong. ξSeriously if you can't handle that simple of an order you should just close!!!!!!","['1.0', '1.0', 0, '1.0', '0.7', 0, 0, 0]"
"they mess up every time i go unless my order is under 3 bucks, even if its just sweet tea, its straight crappy water. ξi called corporate twice, they sent me a coupon which was not even the value of what they made a mistake on. ξmy name was in the BOOK and the lady behind the counter still wanted my receipt. corporate even said i didnt need one. i understand they get jacked all the time, but dont jack your customers....its a pass","[0, '0.7125', 0, 0, 0, 0, 0, '0.6341']"
It was a hot sweltering day and as always this Macdonalds at 12:45 in the afternoon says the icecream ξmachine is broke. EVERYTIME I want to take a chance and go there to get icecream or a shake the machine is down. ξManager what is going on? ξThis is not sometime but just about all the time. ξI have to go out to Macedonia ... this never happens out there.wonder why??,"[0, 0, 0, 0, 0, 0, '1', 0]"
Not lovin' it. ξMessed up a filet-o-fish. ξWait is too long. ξManager overwhelmed. ξLaziest janitor ever.,"['1.0', 0, 0, '1.0', 0, 0, 0, 0]"
"Worst manager EVER! The young Latin female manager would yell and belittle her employees in front of the customers. ξWe were waiting in a long line, she was by the register and decides it a good time to refill the cups. After a few minutes of staring at her to see if she would take my order yells at the girl working the drive-thru to take our order. The manager continues barking orders and insulting her employees as she did NOTHING. ξShe does not led by example. WOWWhere is the owner? He is loosing money having this person run his store.","['1', 0, 0, 0, 0, 0, 0, 0]"
"Slowest fast food ever!!!! I waited too long just to order my food, and then waited even longer just to pay. Then waited even more just to get my food. It took over 15 minutes and only 3 cats were I'm front of me.","[0, 0, 0, '1', 0, 0, 0, 0]"
"Never again will I go to this McD's, or ANY O'Reilly owned McDs if they can't hire quality people! I went through the drive thru and ordered a simple Big Mac, no middle bun, no cheese. ξI get home and open my box to find buns, mac sauce, lettuce, and a pickle....no meat, that's right, NO MEAT, none! ξI tried calling the number on the receipt only to get a fax machine, which only pissed me off more. I drove BACK to McD's and go inside and ask WTH is wrong with them! ξI am laughed at by the KIDS working there, and no one can tell me that they did not make this sandwich like this intentionally b/c of the way I requested it. ξAnd to top it off, this is the 2nd time this has happened! ξI threw a fit! ξThe Mgr took my order again, I told her I wanted HER to make it. ξThese people aren't worth the minimum wage they're paid, if they're that stupid! ξI have a picture and would love to post, but can't see where to do so.","['1.0', '0.6842', 0, 0, 0, 0, 0, 0]"
"More expensive than other MCD's in the area. Same food, less value.","[0, 0, 0, 0, 0, 0, 0, '1']"
"No stars is more appropriate. Every time I come here, they screw something up. Today I ordered a filet light sauce and an unsweet tea. I get to work and what do I find? A filet on a TOASTED bun and some god awful flavored unsweet tea. I tried calling them today and after other experiences and they NEVER pick up their phone. I usually go through the drive-thru because it's convenient. I went into the store and found this place to be a PIG STY.","['0.6562', '0.6562', '1.0', 0, 0, 0, 0, 0]"
"I ordered 2 large coffees one with 4 creams and the other black coffee so I can take to my co-worker but b4 leaving I ask for cream & sugar. The manager looked at me & said ""you didn't order any"" I asked again & he said I would need ur receipt & I need to add it to the order on my computer. There were people waiting in line so I told him to forget it. I left very disappointed. They count cream & sugar! Oh, during the evening they only take cash. SNAKES!!","[0, '1', 0, 0, 0, 0, 0, 0]"
"I drive up and down 90 and have eaten at every McD and this is the worst over all. ξService is always slower than normal, today's visit I was only customer and they couldn't get the order right. ξ I love McD but not this one","[0, '0.6246', 0, '1.0', 0, 0, 0, 0]"
"No milk for the coffee. Only cream. No wonder everyone is fat. Get my coffee, and it's half full. Awesome. All in all, all Micky D's in Vegas suck.On a side note, the new oatmeal is pretty damn good.","[0, '0.6497', 0, 0, 0, 0, 0, 0]"
"I live around the area and when I'm really hungry at a late hour I come here. Also, I can get coffee here for $1. Basically the worse customer service in history. People working there look so depressed and sleepy. Or they look angry that life made them work there. Either way, you wait in line for awhile as there are bums in the background asking people for change.","['1', 0, 0, 0, 0, 0, 0, 0]"
"Stopped in the Drive Thru at this location for a McDouble at around 9:30pm. I asked for it to be made without salt on the meat. When I get to the window, the lady said rather rudely that they could not make it that way because...get this...they had already cooked all the meat for the night and the grill was closed down.I said, ""So if I drive up and order a burger at 4am, you're telling me that you're going to serve me meat that was cooked 8 hours ago?"" She said, ""Yeah, well that's the way all McDonald's operate.""Disgusting. I know McDonald's isn't exactly known for the highest standards, but serving burgers made ""fresh to order"" with 8-hour-old cooked meat is just downright NASTY.","['0.6667', 0, 0, 0, '1.0', 0, 0, 0]"
"Paid the ""airport mark-up"" price for the worst Big Mac that I've ever had. ξThe bread was over-toasted to cover up the staleness of the bun...it didn't. ξThe, Big Mac, which is supposed to be a relatively tall sandwich was not much taller than a McDouble from the Value-Menu...which they don't have at the airport, BTW.","[0, 0, 0, 0, '1', 0, 0, 0]"
"Years of pathetic service, disgusting food, and dangerous mistakes. Why do I keep going back?Having nothing to do with Mcdonalds food in general and more to do with the ability of this specific location to produce it with out killing anybody. I have been going to this particular store for years. It is right around the corner from where I used to live, and is on the way from where I live to pretty much everything I use (gas station, costco, movie theater, market, etc). It is the only convenient location, and for a while Mcdonalds was the only place that had $1 drinks. So those are my lame excuses for repeatedly torturing myself with this horrible place! Service: I used to be a manager with another fast food chain. I know what service SHOULD be. I also know what it usually is. It doesn't have to be 5 star. But the rude attitudes, ridiculously slow service, and inability to get a single order right is really a bit too much. When I say slow service, I am talking 15 minutes is average drive thru time for a dollar menu burger and a soda. Correct orders: Yes, my order can occasionally be complicated (no castup, add big mac sauce)... but when I thought they could do no worse... they messed up an order for 4 large drinks. 2 diet cokes, a lemonade, and an unsweet iced tea (all with extra ice). We received a regular coke, a lemonade, a Dr. Pepper, and a sweet iced tea. 2 drinks had no ice at all. and the other 2 had a few pieces floating around. We have never received a correct order from this store. EVER. I could go on and on about it, but I will stick with this sad example and move on.Dangerous/disgusting/incorrectly made: Something a little different then an order where they put the wrong thing in the bag or mess up a custom, is when they just make it incorrectly or dangerously. Some of the examples of this include pies that expired an hour before I received them, an egg that was completely raw in the middle, and tonights lovely mess up. Tonight I ordered the Angus Mushroom and Swiss. According to the website this should include 2 full slices of swiss cheese and a decent amount of mushrooms. I had about a teaspoon of mushrooms, no sauce, and 1/2 a slice of cheese. That is right, they left off a slice and a half of cheese! In addition, it was a regular (and relatively old) quarter pound patty, not the big ole angus patty they should have used. I have called the number on the receipt multiple times that takes me to the district office. They consistently send out a free sandwich or drink coupon to apologize. They tell me how sorry they are and suggest I try one of their other locations, as this is the only one they receive complaints from. From what I was told they are revamping this store, but I have been told that for well over a year, and it seems to have been unvamped and going down hill, which I didn't think was even possible! I keep vowing this will be my last visit, but then find myself sitting in the drive thru line yet again wondering if I will ever receive my food. I highly do not recommend this location. Hopefully you won't be lured in by whatever the heck keeps luring me! -Sarah (This was written by Paul's wife because I am usually the one dealing with them. I guess he got smarter.)","['1.0', '1.0', 0, '1.0', '1.0', 0, 0, 0]"
"We are retired and have gone to this McDonald's since they built it two blocks from our house. ξThis last year it has gone down hill. ξThey are out of things often, week after week. ξThe service has become poor. ξSome of the long time employees are good but the bad now outweighs the good at that location.The street people hitting you up in the drive through and inside but the managers will do nothing about them. ξTalked to the owner and he said he would see thing get better but they did not. After all these years we decided we no longer need McDonald's and have not been in three months. ξWe have ten grandkids that are not missing it either. ξPoor service has cost them a lot when you think about it over the years.","['1', 0, 0, 0, 0, 0, 0, 0]"
Was so hungry! Didn't had a car and when I requested and wanted to place an order from the drive through window! He says rudely that we can take your order and closes the window on my face! Though I like Mc Donald's but this place is weird!,"['0.6264', 0, 0, 0, 0, 0, 0, 0]"
"A McD's in a kinda sketchy area. ξI've been through the drive thru for breakfast a couple of times. ξThe only thing to really note is they have two places you can order from in the drive thru. ξDon't be an idiot and sit at the first one for too long with out moving to the next one to order, like I did. ξDoh. ξOtherwise enjoy!","[0, 0, 0, 0, 0, '0.688', 0, 0]"
"One thing remarkable about this restaurant, in contrast with all the other many restaurants in the East Village --EVERY type of person in the neighborhood eats here. Old folks, kids, Black, White, Hispanic, Asian, sane, crazy, homeless, homeful...crossing every line there is. No other restaurant accomplishes that. Now, whether all those different people SHOULD eat at McDonald's is another matter...Be great if they'd introduce an ""East Village History"" theme -- pictures of Emma Goldman, Yippies, ee cummings, etc. One last thing. There are people who like McDonald's coffee...WHY???","[0, 0, 0, 0, 0, '0.6784', 0, 0]"
"I guy named Rodrigo identified himself like a manager on Sunday morning 04/20/2014, he was talking about a costumer's dress in front of me with a crew member and messed up my order. I asked to cancel my order and process a refund, I don't tolerate a guy like this to make fun of girls in front of me. He also suggested me to call to the costumer service number if had any complaint. I am wondering if the operator is aware of this guy? I am not coming back and also will suggest my wife do the same.","['0.7', '1.0', 0, 0, 0, 0, 0, 0]"
Kids working drive thru have no idea what they are doing. Usually wait in the pick up window long enough to drink my entire drink and the food is still not ready. They usually forget to add salt to the fries. Today I got sold a pie that said to ' enjoy by 7:41pm ' and was sold to me at around 10pm. I'm not even sure if that is safe to eat. Disapointed in the new location. And a few napkins in my drive thru bag would be nice too.,"[0, 0, 0, '1', 0, 0, 0, 0]"
